{
  "$schema": "https://json-schema.org/draft/2020-12/schema",
  "title": "Actor",
  "type": "object",
  "properties": {
    "id": {
      "type": "string",
      "minLength": 1
    },
    "type": {
      "type": "string",
      "enum": [
        "person",
        "organisation",
        "team",
        "agent"
      ]
    },
    "name": {
      "type": "string",
      "minLength": 1
    },
    "aliases": {
      "type": "array",
      "items": {
        "type": "string"
      },
      "default": []
    },
    "identifiers": {
      "type": "array",
      "items": {
        "type": "object",
        "properties": {
          "scheme": {
            "type": "string"
          },
          "value": {
            "type": "string"
          }
        },
        "required": [
          "scheme",
          "value"
        ],
        "additionalProperties": false
      },
      "default": []
    },
    "created_at": {
      "type": "string",
      "format": "date-time"
    },
    "updated_at": {
      "type": "string",
      "format": "date-time"
    },
    "provenance": {
      "$ref": "provenance.schema.json"
    },
    "extensions": {
      "type": "object",
      "additionalProperties": true
    }
  },
  "required": [
    "id",
    "type",
    "name",
    "created_at",
    "updated_at",
    "provenance"
  ],
  "additionalProperties": false
}
